{"accepted_artifact_manifest_sha256":["21b0be3b45ad54aa49ff839ae814922d4e95e277f2d894a3d9e2a60e96e01b59"],"active_attempts":[],"based_on_revision":7,"checkpoint_kind":"explicit","created_at":"2026-10-14T04:33:12Z","created_by":"pilot.operator","ledger_head_sha256":"1fdf2c56ea7a57c27f0fa316220c09d43942fae3d7a1bd4e88a66c6b0a5d719e","parent_passport_sha256":"9870cfd5442277ca3dce5db98f8c36e33b8317880a6ac82ef7f3c94828b768ee","pending_human_decisions":[],"run_id":"run-f3e090cf-5302-4b22-b91b-fb5c36813b4f","schema_version":"1.0.0","stage":"initialized","supersedes_passport_sha256":"9870cfd5442277ca3dce5db98f8c36e33b8317880a6ac82ef7f3c94828b768ee","workflow_definition_id":"core-research.v1","workflow_definition_sha256":"00042c2329644831b3cb84b5a46e57169cb92cf18177aaf35f9e2ecdcc288683"}
